title,score,id,subreddit,url,num_comments,body,created
Orwell peak,106,tg5spm,RussiaUkraineWar2022,https://v.redd.it/g1flcxb6pwn81,48,,1647507409.0
Crowdfunded DJI Mavic 3 UAVs being sent to DNR and LNR forces.,32,uvr6e2,RussiaUkraineWar2022,https://www.reddit.com/gallery/uvr6e2,18,,1653276469.0
"Russian UAV footage reportedly of a Ukrainian Caesar howitzer. The Russian source claims it was knocked out of action, but there is no confirmation. The source also says there is a new Russian spetsnaz unit tasked with locating NATO equipment with UAVs. - @RALee85 on Twitter",25,w86mft,RussiaUkraineWar2022,https://v.redd.it/2hksvrbrhtd91,25,,1658799742.0
Anyone knows what this gear is? I see it quite a lot on soldiers in Ukraine. 🇷🇴🇪🇺🇺🇸💙💛🇺🇦 Слава Україні!,28,ttoiwi,RussiaUkraineWar2022,https://i.redd.it/yub9vfkjlwq81.png,39,,1648812888.0
Russian T-72B3 towing a captured (and damaged) Ukrainian T-64BV in Chernihiv,27,tc027v,RussiaUkraineWar2022,https://v.redd.it/wrs6st5zjtm81,11,,1647032593.0
"Rampant Russians steal these Ukrainian armoured vehicles near Izium, Kharkiv and write the famous 'Z' on them.",36,tt77p1,RussiaUkraineWar2022,https://www.reddit.com/gallery/tt77p1,17,,1648753858.0
Russian Conscript Breaks down in a blood soaked Ukrainian field. Drawn by myself.,83,uu7q3l,RussiaUkraineWar2022,https://i.redd.it/tk47syk84p091.jpg,13,,1653080742.0
RuskiPartsAreUs.,6,tskmod,RussiaUkraineWar2022,https://www.reddit.com/r/RussiaUkraineWar2022/comments/tskmod/ruskipartsareus/,1,"Ukraine needs a new website to exchange spare parts for captured Russian equipment., so the farmers can repair the captured stuff for farm use. Because Ukrainian farmers are the backbone of the country.

If you need it. we got it. If not, just wait a few days, they will abandon another soon.",1648678128.0
Opinion | What if Putin Didn’t Miscalculate?,3,truh94,RussiaUkraineWar2022,https://www.nytimes.com/2022/03/29/opinion/ukraine-war-putin.html,17,,1648601817.0
Tanks contaminated with biological weapons 👁,0,tchj53,RussiaUkraineWar2022,https://www.reddit.com/r/RussiaUkraineWar2022/comments/tchj53/tanks_contaminated_with_biological_weapons/,8,Was having a conversation with a buddy of  mine the other day…  what if the Russians intentionally left the abandoned convoys contaminated with some kind of contagious disease has this thought crossed any one else’s mind?..,1647095364.0
Russians warning Americans that they need to be careful who is in charge of the nuclear weapons.,24,w6jgyq,RussiaUkraineWar2022,https://twitter.com/Gerashchenko_en/status/1550826605257396224?t=Drp5oSGMFg0p15_FTRk4FQ&s=19,41,,1658625495.0
"She's The Anne Frank of Ukraine. The Story of 17-year-old Maria Vdovychenko and Her Family's Harrowing Escape, Filtration and Multiple Near Death Experiences Under Russian Siege",54,u6zzee,RussiaUkraineWar2022,https://hromadske-ua.translate.goog/posts/ya-prosila-boga-pomerti-shvidko-pro-golod-strah-i-filtracijnij-tabir-vustami-17-richnoyi-divchini-z-mariupolya?_x_tr_sl=uk&_x_tr_tl=en&_x_tr_hl=en&_x_tr_pto=wapp,10,,1650355883.0
NATO Aircraft Boejing E-3A Sentry circulating in Poland near Ukraine border. Does anybody know why?,196,tsxw3c,RussiaUkraineWar2022,https://i.redd.it/1gcsvkpfipq81.jpg,125,,1648727035.0
fixed it*,152,tgqr95,RussiaUkraineWar2022,https://i.redd.it/tdc1ldt7x1o81.jpg,22,,1647569745.0
No Fly Zone - for Dummies,19,t89n5n,RussiaUkraineWar2022,https://www.reddit.com/r/RussiaUkraineWar2022/comments/t89n5n/no_fly_zone_for_dummies/,10," I need to explain this **No Fly Zone** bullshit in a really simple fashion:

Giving AA Missiles to the Ukrainians = killing cockroaches with bug spray  
Setting up a No Fly Zone and risking a Nuclear WW3 = killing cockroaches with a grenade.

In both cases the cockroach gets killed but one of those ways destroys the kitchen and possibly the whole house.",1646604140.0
Orbán calls for lifting EU sanctions on Russia by year end,35,xl6g9s,RussiaUkraineWar2022,https://www.alvinalexa.com/2022/09/orban-calls-for-lifting-eu-sanctions-on.html,58,,1663864994.0
recently I saw a video where the Ukrainian army was using one of the the new machine guns that our army is using to replace the M49 light machine gun the name of it is XM250 and it is kinda fascinating how we are sending this type of equipment which wasn't even come out!,42,w3w2g5,RussiaUkraineWar2022,https://www.reddit.com/r/RussiaUkraineWar2022/comments/w3w2g5/recently_i_saw_a_video_where_the_ukrainian_army/,44,Do you think that the us army is secretly working in Ukraine in small amounts and can someone update me on how many losses the Russian army has.,1658347567.0
Soldiers of the 100th brigade of the DPR clearing up a trench of the Armed Forces of Ukraine,0,wy77fn,RussiaUkraineWar2022,https://v.redd.it/8qwpz606r1k91,9,,1661514886.0
"Russian battalion leader showing his puppets some NATO weapons they seized, well good luck because they won't have much ammo with them and most are one time use. Enjoy them whilst you can boys, don't misfire them now.. That would be terrible.",79,tgp8dw,RussiaUkraineWar2022,https://v.redd.it/z71dh198j1o81,55,,1647565088.0
Putin warns West against sending arms; Kyiv hit by missiles,16,v5z9yr,RussiaUkraineWar2022,https://timesofindia.indiatimes.com/world/europe/russia-ukraine-war-live-updates-june-6/liveblog/92024824.cms,4,,1654508804.0
Animals in Mariupol Zoo were killed from Russian shelling,18,ugpttp,RussiaUkraineWar2022,https://www.reddit.com/r/RussiaUkraineWar2022/comments/ugpttp/animals_in_mariupol_zoo_were_killed_from_russian/,3,"
The invaders killed:

5 camels,
3 llamas,
6 monkeys,
4 ostriches,
1 leopard.",1651498649.0
Russian Opinion,16,thwc9j,RussiaUkraineWar2022,https://www.reddit.com/r/RussiaUkraineWar2022/comments/thwc9j/russian_opinion/,37,I’d love to see one credible report about the general Russian populations opinion on this war. It’s always either “Russians forced to attend Putins rally” or “80% of the Russian population agrees with the invasion”. How are we supposed to believe these reports based on these people being stuck inside Putins media machine. I’m not looking to make any excuses for these people I’m genuinely curious. Can someone please link the most credible piece of reporting they’ve found on how Russians really feel about this?,1647700094.0
That's the internet for you,58,t6l4ru,RussiaUkraineWar2022,https://v.redd.it/omq7vbi3hdl81,33,,1646406859.0
New information has now been revealed that the reason Andrew Hill was captured is that he was ordered to defend a position that had already been abandoned by another unit,22,wuj62y,RussiaUkraineWar2022,https://www.mirror.co.uk/news/world-news/brit-fighter-ukraine-foreign-legion-27794503,7,,1661140392.0
"Video of the launch of the same Sarmat ballistic missile, which, according to Putin, ""will ensure the security of Russia and make those rabid who try to threaten her think.""",23,u7yi6k,RussiaUkraineWar2022,https://v.redd.it/jibk4but7pu81,31,,1650466874.0
Putin heard 'loud and clear' call for regime change after Biden said he 'cannot remain in power': expert,23,tpbi2z,RussiaUkraineWar2022,https://www.yahoo.com/news/putin-heard-apos-loud-clear-212040393.html,30,,1648351675.0
Russian Pantsir-S1.,0,wintut,RussiaUkraineWar2022,https://i.redd.it/u5rr58upecg91.jpg,3,,1659900443.0
Russia dropped a bomb on Berdychiv as a Nazi in 1941,8,tirk1t,RussiaUkraineWar2022,https://www.reddit.com/r/RussiaUkraineWar2022/comments/tirk1t/russia_dropped_a_bomb_on_berdychiv_as_a_nazi_in/,1,"Russia dropped a bomb on Berdychiv as a Nazi in 1941

https://preview.redd.it/w826mle21lo81.jpg?width=1920&format=pjpg&auto=webp&s=451588af9f79d2ad85fa2267fe6d15876e62aadf

https://preview.redd.it/kkazuwe21lo81.jpg?width=1920&format=pjpg&auto=webp&s=4f079bc78ea06d85d08d6633f5ac92694124b8f4

https://preview.redd.it/ouavmne21lo81.jpg?width=1920&format=pjpg&auto=webp&s=bf67cd23b88d4c52662e452430fbeb977d7cd388",1647801187.0
3 Options,7,teeify,RussiaUkraineWar2022,https://www.reddit.com/r/RussiaUkraineWar2022/comments/teeify/3_options/,11,"I only see three options for this ending without further escalation:
1: Putin withdraws his forces.
2: Covid catches his immune suppressed arse and he is replaced. Or
3: a Russian steps up as the hero Russia needs, and collects some bounties!",1647311453.0
The Far-Right Book Every Russian General Reads,9,tdf33i,RussiaUkraineWar2022,https://www.reddit.com/r/RussiaUkraineWar2022/comments/tdf33i/the_farright_book_every_russian_general_reads/,1,[https://www.thedailybeast.com/the-far-right-book-every-russian-general-reads](https://www.thedailybeast.com/the-far-right-book-every-russian-general-reads),1647201639.0
"Big sigh ""The United States has proposed a prisoner swap with Russia in an effort to free a detained American basketball star.""",15,w9wxxk,RussiaUkraineWar2022,https://dumpgoose.com/prisoner-swap-for-basketball-star/,19,,1658973840.0
Ukrainian ATGM missile misses a Russian tank.,13,ticmcj,RussiaUkraineWar2022,https://v.redd.it/l0moh0cwogo81,4,,1647748564.0
"For the first time we are now seeing more videos of Russian attack drones in action, personally I think this is a response to the TB2 footage circulating",39,tiqg39,RussiaUkraineWar2022,https://v.redd.it/5g9dz9sdsko81,11,,1647798158.0
Putin is panicking over revolution in Moscow,38,ticct0,RussiaUkraineWar2022,https://www.reddit.com/r/RussiaUkraineWar2022/comments/ticct0/putin_is_panicking_over_revolution_in_moscow/,11,"..according to UK PM Boris Johnson. If Russia implodes, what would happen with this horrific war in Ukraine?

[https://www.mirror.co.uk/news/uk-news/putin-panicking-over-revolution-moscow-26508643](https://www.mirror.co.uk/news/uk-news/putin-panicking-over-revolution-moscow-26508643)",1647747630.0
Russian troops surrender in droves as Putin's army crumbles under Ukrainian onslaught | World | News,68,x1eqce,RussiaUkraineWar2022,https://www.express.co.uk/news/world/1662108/russia-news-putin-army-surrenders-en-masse-kherson-counteroffensive-ukraine-war-update,18,,1661852555.0
Explained: The deadly chemical and biological weapons Russia could deploy in Ukraine,11,tofuzm,RussiaUkraineWar2022,https://www.telegraph.co.uk/world-news/2022/03/25/explained-what-chemical-biological-weapons-russia-putin-deadly/,3,,1648265203.0
What do you think about this?,10,t3j7df,RussiaUkraineWar2022,https://v.redd.it/1qfl8l6kykk81,25,,1646064937.0
Ukrainian soldiers captured by Russian bandits. Godspeed for those caught.,30,uoad4t,RussiaUkraineWar2022,https://v.redd.it/sgq70uhzu3z81,16,,1652387543.0
Fallen Ukrainian comrades in a trench system in Donbass. R. I. P 🇺🇦,132,whz71p,RussiaUkraineWar2022,https://i.redd.it/4kynas23z5g91.jpg,32,,1659822545.0
Poo tin,21,tehtsd,RussiaUkraineWar2022,https://i.redd.it/qxj2eo2iihn81.jpg,2,,1647322658.0
Nuclear Attack,19,t6ipdb,RussiaUkraineWar2022,https://i.redd.it/9tgk408o9dl81.jpg,4,,1646399596.0
Destroyed Ukrainian tanks on the outskirts of Mariupol!,21,t52jkm,RussiaUkraineWar2022,https://v.redd.it/zc5ggwaonzk81,7,,1646234803.0
"(Russian propaganda) ⚠ FAKE NEWS FROM Russian troops, pretending they're looking after the locals after they purposely destroyed their homes.",69,tcvt1s,RussiaUkraineWar2022,https://v.redd.it/andznq17z1n81,32,,1647134567.0
On the topic of war,2,tis6su,RussiaUkraineWar2022,https://www.reddit.com/r/RussiaUkraineWar2022/comments/tis6su/on_the_topic_of_war/,3,"I just finished rewatching CG, and the ending always gets me, but that got me thinking, do you guys think Putin might be trying to pull a Lelouch ?",1647802930.0
Which country do you think is most responsible for causing this conflict?,3,t9xr4z,RussiaUkraineWar2022,https://www.reddit.com/r/RussiaUkraineWar2022/comments/t9xr4z/which_country_do_you_think_is_most_responsible/,11,"

[View Poll](https://www.reddit.com/poll/t9xr4z)",1646794058.0
"R/Ukraine seems to have been taken down, what’s happening?",3,t7f72e,RussiaUkraineWar2022,https://www.reddit.com/r/RussiaUkraineWar2022/comments/t7f72e/rukraine_seems_to_have_been_taken_down_whats/,9,,1646503734.0
Russia's New 'Poseidon' Super-Weapon: What You Need To Know - Naval News,3,t5p8cd,RussiaUkraineWar2022,https://www.navalnews.com/naval-news/2022/03/russias-new-poseidon-super-weapon-what-you-need-to-know/,2,,1646305830.0
"Please, act right now!",89,t6g97w,RussiaUkraineWar2022,https://i.redd.it/xkkfzdxticl81.jpg,16,,1646390537.0
Maybe week ago part of runway was still under Ukrainians but now i can see some significant push from RU. Is this bc Ukrainians cant operate under RU artillery or RU infantry started new offensive ? Since the beginning of the war there has been no success in the area of Donetsk AirPort until now.,34,wl0qif,RussiaUkraineWar2022,https://i.redd.it/jswkjzjnpwg91.jpg,38,,1660146259.0
RUSSIANS DO NOT WANT WAR!!!,31,t4p8nb,RussiaUkraineWar2022,https://www.reddit.com/r/RussiaUkraineWar2022/comments/t4p8nb/russians_do_not_want_war/,75,RUSSIANS DO NOT WANT THIS WAR!!! PUTIN IS ON DRUGS!,1646187917.0
JUST IN! Kinky Kadyrov spotted inside Putins package. 😬,107,uozk8r,RussiaUkraineWar2022,https://i.redd.it/hp3ufso6qaz81.jpg,12,,1652470669.0
Russian troops seize NATO equipment in Ukraine. This is never a good sign.,209,tf5mqn,RussiaUkraineWar2022,https://v.redd.it/m82plc07cnn81,135,,1647393179.0
Full video from today - Kherson: Russian artillery halting a Ukrainian offensive with the use of BMP-1s.,0,x1xj1b,RussiaUkraineWar2022,https://v.redd.it/i07j4imknxk91,9,,1661901068.0
"Russian Orc's 🇷🇺⚡️Iskander-M missile system firing at Ukrainian targets. Seems to be a bit to propaganda, check out the astro turf camouflage on that thing? Bayraktar target if you ask me....",29,ugnz26,RussiaUkraineWar2022,https://v.redd.it/ur0q1qk1y1x81,17,,1651492672.0
"Meanwhile on Russian state TV: ""We should support Trump and not be shy about it.""",114,wjc101,RussiaUkraineWar2022,https://v.redd.it/llp514w6fig91,74,,1659973268.0
"EU leaders have very reliable evidence that China is considering providing military assistance to Russia, ""Politico, citing a senior EU official. This will be a complete shame for China!!!",109,tvhud5,RussiaUkraineWar2022,https://i.redd.it/g545ospq9dr81.png,59,,1649014842.0
In the Occupied areas of Ukraine russia puts back the statues of Vladimir Lenin.,48,ufg3oj,RussiaUkraineWar2022,https://i.redd.it/2jq99x7zdpw81.jpg,35,,1651340623.0
US Republican Russian Shills pt.2,310,tys2ra,RussiaUkraineWar2022,https://i.redd.it/84wtsdilj7s81.jpg,139,,1649381197.0
Idiot thought he could loot in a war zone with no limits. Karma served. His little Jimmy Rodger must be FREEZING on that metal pole. Looks like he's got some bush to keep the icicles off though 😂,164,t6zyx5,RussiaUkraineWar2022,https://v.redd.it/12sv38fedhl81,54,,1646449404.0
I made a video on what Russia's next move could be. I hope it can be of interest to some of you. Slava Ukraini!,42,xjl8io,RussiaUkraineWar2022,https://v.redd.it/7h8w6s7a03p91,6,,1663709461.0
"The Ukrainian military have some great photographers, shit looks like 1st person Call Of Duty. Surreal weapon right here.",43,tpxyb1,RussiaUkraineWar2022,https://i.redd.it/mu8q0wrd01q81.jpg,5,,1648430397.0
"(RUSSIAN PROPAGANDA) ⚠ Russian troops seen handing over essentials to residents in the Dergachev district of the Kharkiv region just the northern outskirts of the region. It is spectacular considering they caused the humanitarian crisis, also they were EXTREMELY carful not to show any destruction..",39,tf6tlt,RussiaUkraineWar2022,https://v.redd.it/sh24dmhxmnn81,17,,1647396834.0
"Russian hackers hacked into Ukrainian television again, writing on a ticker: “Your president has been assassinated. Put down your weapons. kyiv is surrounded. Glory to Russia!""",105,u9k682,RussiaUkraineWar2022,https://v.redd.it/7gtuxkqd94v81,50,,1650649005.0
Looking for Russian AV with letter A marking,1,uqx8tz,RussiaUkraineWar2022,https://www.reddit.com/r/RussiaUkraineWar2022/comments/uqx8tz/looking_for_russian_av_with_letter_a_marking/,4,"Can't find anywhere Russian vehicle with A mark. I think I saw somewhere.

Please post here if you have such image/video.

Ruscists use Z, A, V, O, X letters. The most commonly used Z and less V. Rarer O.",1652711299.0
Can someone explain something to me?,1,tst24p,RussiaUkraineWar2022,https://www.reddit.com/r/RussiaUkraineWar2022/comments/tst24p/can_someone_explain_something_to_me/,6,Putin is outwardly negotiating to pull his troops from Kyiv and the north in order to focus his attention on the east. Why on earth would Ukraine even allow this to happen? Those units are separated and cause less of a threat in their current positions. Am I wrong?,1648705935.0
Can Molotovs destroy tanks?,1,t7tw2x,RussiaUkraineWar2022,https://www.reddit.com/r/RussiaUkraineWar2022/comments/t7tw2x/can_molotovs_destroy_tanks/,14,A saw a video of Ukrainian citizens throwing them at one,1646552841.0
Massive explosions rock Kyiv as Putin's forces seize first city,0,t5o18c,RussiaUkraineWar2022,https://www.mirror.co.uk/news/world-news/russia-ukraine-updates-war-live-26363658,2,,1646300875.0
Theories behind the invasion,1,t5n9gz,RussiaUkraineWar2022,https://www.reddit.com/r/RussiaUkraineWar2022/comments/t5n9gz/theories_behind_the_invasion/,7,"Hi

i've read an article about the theories behind the war in Ukraine. There was a guy mentioned who wrote books and created these theories Putin talks about which claim that UdSSR has to be united again and similar theories. Does anyone know the name of him?",1646297545.0
What do you guys think of this?,0,t22aoc,RussiaUkraineWar2022,https://www.reddit.com/r/RussiaUkraineWar2022/comments/t22aoc/what_do_you_guys_think_of_this/,14,[https://twitter.com/Aryan\_warlord/status/1497506450502926337/photo/1](https://twitter.com/Aryan_warlord/status/1497506450502926337/photo/1),1645896521.0
"Russian footage claiming the destruction of a MLRS ""Himars"" system hidden in a forested area (not sure if confirmed).",155,whmgkb,RussiaUkraineWar2022,https://v.redd.it/kibqigvqz2g91,132,,1659786471.0
"Kremlin announces vote, paves way to annex part of Ukraine",15,xptfhp,RussiaUkraineWar2022,https://apnews.com/article/1780c30715ce49723629d05c5e2f3238,5,,1664314488.0
Why Vladimir Putin is unlikely to be removed from office,14,wf3ham,RussiaUkraineWar2022,https://redactionpolitics.com/2022/08/02/putin-russia-ukraine-oligarchs-invasion-nato/,6,,1659524044.0
unbiased responses on what is happening in ukraine,14,vbre91,RussiaUkraineWar2022,https://www.reddit.com/r/RussiaUkraineWar2022/comments/vbre91/unbiased_responses_on_what_is_happening_in_ukraine/,28,Like what is happening in the east. I keep on seeing new pictures and videos of the russian army being destroyed via tank columns and drones  but another article says that russia is gaining ground. I want to know unbiasedly what is happening,1655168624.0
"02.07.2022 Volcheyarovka (near Lisichansk), killed Ukrainian soldiers (voice count to 7)",0,vps80t,RussiaUkraineWar2022,https://v.redd.it/txyy453jt5991,10,,1656769778.0
Why can't we hear both sides?,0,tc6mj1,RussiaUkraineWar2022,https://www.reddit.com/r/RussiaUkraineWar2022/comments/tc6mj1/why_cant_we_hear_both_sides/,66,"RT and RT America has been banned in the United States.  We ( the USA)are supposed to be the role model for a free and open society.  I was born here.  I have an inalienable right to listen/watch whatever I want and decide for myself.  Do the elites, NeoCons, &c. think I am too stupid to discern truth from lies?  I demand to hear from ALL sides about what is happening in Ukraine.  This only makes me suspicious.",1647053009.0
"Belgian politician is against an EU-wide visa ban for Russian tourists. The Minister of Foreign Affairs of Belgium, Hadja Lahbib said: „the country is against 'indiscriminate measures' against Russians“. Before being appointed as FM on July 15th, she visited Crimea and said she had been „in Russia”.",43,x2vgjw,RussiaUkraineWar2022,https://twitter.com/visegrad24/status/1564946492913229824?s=21&t=i_N9nCM7LiTdT8LiIQjPbg,21,,1661998215.0
