title,score,id,subreddit,url,num_comments,body,created
American psychiatrist diagnosed Putin,34,w4a68i,RussiaUkraineWar2022,https://www.reddit.com/r/RussiaUkraineWar2022/comments/w4a68i/american_psychiatrist_diagnosed_putin/,28,"  James Fallon believes that the President of the Russian Federation is very dangerous, and in conditions when he is in danger of losing everything, he will be able to use nuclear weapons.

James Fallon has been closely following Vladimir Putin’s actions for several years in order to recreate the course of his thoughts on the decisions made, writes The insider. Psychiatrist, professor at the University of California Fallon specializes in psychopathic personality disorders. To make sure the diagnosis was correct, he spoke with the leaders of Ukraine, representatives of the leadership of Russia, Chechnya, Belarus and Germany, and also read everything he could find about the upbringing and formation of the Russian dictator.

“You can’t just see someone on TV and say ‘this is a psychopath’,” the psychiatrist emphasizes. “But, in my opinion, Putin did have important prerequisites for the development of the so-called cluster B personality disorders – the most dangerous ones, including psychopathy and narcissistic disorder personality”.

**What is psychopathy?**

To describe this disorder, Fallon uses the definition proposed by the American psychiatrist Hervey Cleckley. In 1941, in The Mask of Sanity, he described the psychopath as a person who appears normal and does everything to maintain this illusion. However, all psychopaths are distinguished by low emotional empathy. All of them are manipulators, selfish and aggressors who cannot feel pity, remorse or guilt. At the same time, they are callous and put themselves above all. 

The psychiatrist notes that psychopaths are divided into primary and secondary. In the former, the development of pathology is due to a process called “epigenetic marking” and manifests itself already in the first years of life. Due to trauma and exposure to stress hormones, the regulation of key genes changes almost irreversibly, this affects hormones in the frontal and temporal lobes of the brain.

Changes in the psyche of secondary psychopaths, also called sociopaths, are caused by emotional, physical, sexual abuse or bullying, and are partly reversible.

The behavior of psychopaths of both types is very different: a sociopath knows that he is acting immorally, but cannot stop, a psychopath is sure that he is doing the right thing, believing that he is right.

“This is an integral trait of the personality of a true primary psychopath: he never doubts that he is doing the right thing,” says James Fallon. Putin”.

**What provokes the aggression of a psychopath?**

The psychiatrist emphasizes that psychopaths are always looking for weakness in their victims, it is she who provokes them. Not being able to experience emotions, they are able to read them, they are well versed in other people’s feelings, fears, triggers and desires. With this knowledge, psychopaths manipulate their victims into getting the desired reaction, money, sex, or simply reveling in a sense of control.

“Putin’s key method is to keep his opponents from getting stronger, to strike at their weakest moment,” Fallon notes. “Self-disciplined psychopaths have the patience to wait months, years, even 10 years, until their victim shows vulnerability.”

In addition to this, the Russian dictator can be attributed to malignant narcissists, and the features of a sadist also appear in him. “It just doesn’t get worse,” says the psychiatrist.

In his opinion, several traumas made Putin so: a difficult childhood, and then the collapse of the USSR, which led to the creation of an independent Ukraine. Hitler experienced something similar in his youth. In 2011, Putin saw Libyan dictator Gaddafi die in agony, cementing a deep fear of violent regime change.

“All the implicit has been revealed in the last few years, and especially brightly in the last few weeks until February 24,” notes James Fallon. “Putin, like Hitler, revealed his true nature, and it became clear that he was acting precisely as a psychopath, and not a sociopath and certainly not like a normal person with bad tendencies.”

The psychiatrist is sure that Vladimir Putin’s behavior shows signs of clouding his mind: from pompous narcissism, he moved on to paranoia and hostile unbalanced behavior. Probably degenerative processes are going on in his brain.

## What to expect from Putin?

Vladimir Putin used to be calm, cold and prudent in public, but now it is more difficult for him to control himself, this indicates that he is extremely dangerous. It is difficult to predict his decisions, as the Russian president is losing his adequacy.

Rebuffed in Ukraine, he may feel stumped, Fallon said. When confronted with resistance, psychopaths and aggressors get lost and may even take flight, but Putin has nowhere to run. Now he has stopped hiding his feelings and this makes him even more dangerous, since it is no longer necessary to maintain the image of a cold-blooded person.

Psychopaths are distinguished by the fact that they are ready to do anything to achieve the goal. Achieving his own, Putin willingly commits war crimes, and he is one step away from using tactical nuclear weapons.

“People with psychopathy can take a lot, but as soon as the stress becomes too strong or prolonged, if they end up cornered, they lose control of themselves,” the psychiatrist emphasizes. “It is impossible to predict when Putin will be at this point. But when it comes, he will either run away or want to tear everything down and go all the way.. It only seems like irrational behavior, but in reality he is just testing the limits, drop by drop, like any bully testing someone for weakness. Say, let’s try , but if it doesn’t work out, we will step back and say: “Oh no, all we wanted was the Donbass.”

## How to neutralize Putin?

Putin is a clear primary charismatic psychopath who does not intend to openly show anger. Such predators retreat. when they get a rebuff. But if you corner them, they will start to defend themselves in all available ways, says James Fallon.

In his opinion, the best tactic for dealing with psychopaths is gradual and constant pressure on Putin without sudden movements, so as not to provoke a nuclear war. Under these conditions, sooner or later he will definitely make a mistake.

“Now taking drastic, drastic measures is not the best way out,” the psychiatrist is sure.

Fallon believes that Putin is waiting for a misguided move from Ukraine that, in the eyes of most Russians, will give him the right to any response. To do this, he needs a massive strike from Ukraine on a Russian settlement, or some larger target.

At the same time, it is clear that Putin cannot win this war: the more support Ukraine receives, the weaker the support of the dictator himself in his entourage. In the end, one of the Russian generals will be able to tell him that it is impossible to do this. However, according to the psychiatrist, this will require another months of struggle.

“Based on my knowledge of military psychology, I think it’s worth showing Putin that the West will stop at nothing,” says Fallon. point where we can wipe you off the face of the earth. We don’t want to do it, but we can.”

Recall that earlier Dr. Kenneth Dekleva says Putin is in an “echo chamber”where he does not hear other opinions.

**Appoline Petti** 

https://preview.redd.it/ocz718tvgvc91.jpg?width=1280&format=pjpg&auto=webp&s=1dbb2dbf07d08d11bfefffccc1a944c0982afd51

[https://apolline-petit.com/american-psychiatrist-diagnosed-putin](https://apolline-petit.com/american-psychiatrist-diagnosed-putin)",1658387816.0
"Sorry folks posted the wrong video, this is CRINGE",32,uxioub,RussiaUkraineWar2022,https://v.redd.it/bfe2z4yium191,5,,1653489109.0
Putin World Declares ‘Our Agent Trump’ Is Irreversibly Screwed,47,wq92t7,RussiaUkraineWar2022,https://www.thedailybeast.com/russian-state-media-declares-our-agent-donald-trump-is-irreversibly-screwed,16,,1660692565.0
Russian training: tourniquets.,113,wngn4b,RussiaUkraineWar2022,https://v.redd.it/zn0j9opexhh91,106,,1660403116.0
"Kadyrovites admitted: Putin's order is to destroy Mariupol Kadyrov declared for the 100,500th time that Mariupol was taken “finally and irrevocably”, and the entire territory was systematically cleared of “nationalists” 🇺🇦 Ukraine Now",397,u8te4o,RussiaUkraineWar2022,https://v.redd.it/ky9xo6pf7xu81,194,,1650563588.0
Question: how is it possible for a super power like russia to preform so badly against a small nation like Ukraine? Doesn’t Russian have a good military?,167,xcbbth,RussiaUkraineWar2022,https://www.reddit.com/r/RussiaUkraineWar2022/comments/xcbbth/question_how_is_it_possible_for_a_super_power/,267,,1662985175.0
Video of a Ukrainian YPR-765 APC struck by a mine in Kherson Oblast.,0,xfg13w,RussiaUkraineWar2022,https://v.redd.it/wwfyrn4t15o91,8,,1663298141.0
$580 million dollar boat seized! You’re confused? I’m fucking confused! All that money could be used in places to benefit the world..,32,tcwad8,RussiaUkraineWar2022,https://www.reddit.com/r/RussiaUkraineWar2022/comments/tcwad8/580_million_dollar_boat_seized_youre_confused_im/,10,,1647136184.0
BREAKING: Russia will Allow “Friendly Countries” to buy Gas and Oil in Bitcoin,13,tmr7lv,RussiaUkraineWar2022,https://news.coincu.com/75404-breaking-russia-oil-in-bitcoin/,9,,1648144262.0
"Does anyone else feel that Russia is only saying ""no more sanctions please"" as a way to convince the world to be satisfied with that tactic rather than getting more directly involved militarily?",14,t77fyh,RussiaUkraineWar2022,https://www.reddit.com/r/RussiaUkraineWar2022/comments/t77fyh/does_anyone_else_feel_that_russia_is_only_saying/,5,"I mean it just feels a bit ridiculous for Russia to say ""no no stop no more sanctions ouchie ouch ouch!"" Even if it is actually hurting them, I feel like it rallies the world to focus on the sanctions and be satisfied with that, almost in a way, reinforcing that pure sanctions are the way to go.

I think that military aid in the form of hardware and Intel is obviously helpful but eventually other countries are going to have to get involved. I just hope it's not only sanctions that Are imposed as ""the big guns"".",1646479224.0
Foreign minister of Hungary says they will not allow the transport of weapons for Ukrainians to pass through Hungarian territory (I’ll post the reputable source in comments),12,t3olk5,RussiaUkraineWar2022,https://i.redd.it/sy6vsxv7smk81.jpg,15,,1646078914.0
"Irish Member of European Parliament, Clare Daly, making an ass out of herself again.",805,vezam6,RussiaUkraineWar2022,https://v.redd.it/i0w3j3y7gb691,393,,1655530391.0
Interview: What’s going on in the White House? Why won’t Biden hand over long-range HIMARS?,26,wl7ih5,RussiaUkraineWar2022,https://euromaidanpress.com/2022/08/07/interview-why-wont-biden-hand-over-long-range-himars-atacms/,31,,1660162401.0
How to tease a Russian,26,t6so38,RussiaUkraineWar2022,https://v.redd.it/9k8lnevujfl81,4,,1646427214.0
A dead member of Azov in Mariupol. Rest in peace mate. Its so sad to see this shit unfold.,60,to9edc,RussiaUkraineWar2022,https://i.redd.it/q3uvq5a5gmp81.jpg,61,,1648254097.0
Is there reliable sources of the partisans operating in Russia or Belarus?,18,vsm1ju,RussiaUkraineWar2022,https://www.reddit.com/r/RussiaUkraineWar2022/comments/vsm1ju/is_there_reliable_sources_of_the_partisans/,6,"We keep seeing videos and posts about things being 'On fire' in Russia - and other than a handfull of ones of partisans showing off throwing Molotov's at recruiting centers, the industrial complexes and skyscrapers, I'm wondering how much of this is just 'hype driven' (IE: We have industrial fires in the US peroidically, during a time of war it could easily be looked at as partisan work.)   


It's so rare to see an actual ""Street level"" view in Russia, I've read reports of protests and mass police arrests but silence as far as video or picture evidence. Anyone have any reliable inside-russia sources?",1657100422.0
More footage of Ibrahimkhalil Hajiyev after he took multiple blasts to the head from Ukrainian warriors.,18,tl7vur,RussiaUkraineWar2022,https://v.redd.it/u3x422o0j6p81,11,,1648061352.0
"Ukraine crisis: Zelensky warns of World War III, if talks with Russia fails",18,tj460a,RussiaUkraineWar2022,https://www.business-standard.com/article/international/ukraine-crisis-zelensky-warns-of-world-war-iii-if-talks-with-russia-fails-122032100052_1.html?utm_source=SEO&utm_medium=NJ,22,,1647839620.0
"Stand Up comedian Nurlan Saburov is approached by Ukrainian activist about his silence about Russia's attack on Ukraine, but instead he makes a joke that she's on her period and everyone laughs.",131,u2ut3z,RussiaUkraineWar2022,https://v.redd.it/y0hfvz69tbt81,56,,1649868789.0
"Russian POV combat footage here, this video was filmed in the Mariupol area recently, we can't see any Ukrainian forces here as they're hidden, this is excellent footage of pure Urban combat footage",213,tt25er,RussiaUkraineWar2022,https://v.redd.it/k22waft6lqq81,101,,1648740101.0
KIA Russian Soldier 🔞,235,wx1jgc,RussiaUkraineWar2022,https://v.redd.it/9yazlwidorj91,32,,1661392839.0
"Macron suggested Ukraine give up some of its sovereignty to allow Putin to save face, says Zelensky",345,upgbp2,RussiaUkraineWar2022,https://news.yahoo.com/macron-suggested-ukraine-sovereignty-allow-154400551.html,371,,1652531667.0
Zelensky drinking coffee and chatting with his fellow Kyiv defenders this morning. Imagine what a moral boost it must be for these troops to have the freakin’ president literally fighting next to you.,54,t7sgpt,RussiaUkraineWar2022,https://v.redd.it/kvolmkn1n8k81,12,,1646546722.0
Do your homework,68,t781gx,RussiaUkraineWar2022,https://v.redd.it/op3t83jaoel81,30,,1646481671.0
Video of a Russian aircraft (presumably Su-25) dropping aerial bombs in the Kherson direction.,41,xp3e80,RussiaUkraineWar2022,https://v.redd.it/e1kwttjx7bq91,4,,1664244535.0
A pair of Russian Su-25s over the Sea of ​​Azov,33,w6zo8l,RussiaUkraineWar2022,https://v.redd.it/2cxj34p1njd91,7,,1658680449.0
What my Syrian roomate thinks about the war,49,t6refc,RussiaUkraineWar2022,https://www.reddit.com/r/RussiaUkraineWar2022/comments/t6refc/what_my_syrian_roomate_thinks_about_the_war/,116,"I have a roomate who is an immigrant from Syria. He believes that
1. America tricked Russia into attacking Ukraine
2. America fooled Russia into believing they should fight Russia for ""freedom"" he considers this freedom comical for some reason
3. Russia is protecting people who speak Russian in 
Ukraine
4. In the end of this war people of Ukraine will ""fuck Russia"" and America will make a lot of money like ""what happened in Afghanistan"" 
5. America shut off Russian internet and RT news

So I dont believe any of this. But I've got to live with this guy who has this convoluted view of the world. 
So I'm guessing this is how Syrians feel. 
Where do I even start with this guy? Is he a lost cause? What would you tell him to open his mind?",1646423699.0
There will be documentaries/movies about this war in a couple of years. What will it be called?,25,uuhj6j,RussiaUkraineWar2022,https://www.reddit.com/r/RussiaUkraineWar2022/comments/uuhj6j/there_will_be_documentariesmovies_about_this_war/,55,"Here are some titles I can think of:

1. The rise and fall of Russia
2. The (twenty) second greatest army
3. Putin’s last stand
4. How to lose a country
5. Zelensky’s last laugh
6. The story of New Ukraine
7. Embarrassing militaries of history
8. How the Farming Tractor Union (FTU) got its start
9. Nuclear failure
10. How the poo-tin got it’s name

What’s a documentary/movie name you would like to see?",1653115430.0
Victory day marked in Mariupol,9,ulsqvt,RussiaUkraineWar2022,https://i.redd.it/uajmoregpgy81.jpg,11,,1652107217.0
"A Russian orc was wounded by Azov soldiers while trying to cross the street near Azovstal, but survived, and he had enough endurance under fire to crawl another 50m.",9,ucc7ca,RussiaUkraineWar2022,https://www.reddit.com/r/RussiaUkraineWar2022/comments/ucc7ca/a_russian_orc_was_wounded_by_azov_soldiers_while/,7,[https://tpyxa.net/2022/04/26/a-russian-orc-was-wounded-by-azov-soldiers-while-trying-to-cross-the-street-near-azovstal-but-survived-and-he-had-enough-endurance-under-fire-to-crawl-another-50m/](https://tpyxa.net/2022/04/26/a-russian-orc-was-wounded-by-azov-soldiers-while-trying-to-cross-the-street-near-azovstal-but-survived-and-he-had-enough-endurance-under-fire-to-crawl-another-50m/),1650978517.0
Russian President Vladimir Putin endorsed a possible transfer of foreign production facilities leaving the country under external management.,11,tbdliq,RussiaUkraineWar2022,https://v.redd.it/8v96zkbhhnm81,10,,1646959109.0
"Mods have mercy on me, sorry if it doesn't fit with the subreddit but we need all the support we can, we need to get rid of Russian propaganda in reddit once and for all",10,t3oefj,RussiaUkraineWar2022,https://chng.it/kYZwSPjCN6,3,,1646078420.0
"Some ""historical discoveries"" from the orcs. Vadim Topalov, an employee of the Oplot TV channel of Russian proxies in occupied Donetsk, called the US national flag and a chevron with the emblem of the UN peacekeeping mission in Kosovo ""the aesthetics of the Third Reich.""",35,x9dbvq,RussiaUkraineWar2022,https://v.redd.it/59uofywekpm91,23,,1662674867.0
Get em girl.,152,tkd8el,RussiaUkraineWar2022,https://i.redd.it/spgqy1e430p81.jpg,23,,1647983366.0
can ukraine survive the attrition against russia,24,vaanp9,RussiaUkraineWar2022,https://www.reddit.com/r/RussiaUkraineWar2022/comments/vaanp9/can_ukraine_survive_the_attrition_against_russia/,46,"this is unbiased by the way as if this conflict drags out can ukraine survive the attrition? honestly it all depends on support of weapons from other countries in which there is a small divide on whether countries should deliver long range weapons or smaller weapons, and men who volunteerly join the conflict.",1654994792.0
Russia claims to have taken full control of Mariupol,23,uu7ar0,RussiaUkraineWar2022,https://webchennel.com/world/russia-claims-to-have-taken-full-control-of-mariupol/,17,,1653079525.0
ANONYMOUS TALKING ABOUT BITCOIN AND DECLARING THE WAR TO PUTIN IN MOSCOW,23,t2a0mb,RussiaUkraineWar2022,https://v.redd.it/ubcdc8h1h9k81,6,,1645917806.0
Now is the Time for Ukraine to go All out and Expel the Orcs From all the Borders of Ukraine,44,tr4vtz,RussiaUkraineWar2022,https://www.reddit.com/r/RussiaUkraineWar2022/comments/tr4vtz/now_is_the_time_for_ukraine_to_go_all_out_and/,21,"The recent result of peace talk suggests that Russians is on the retreat. Do not let them leave calmly, they came to Ukraine to burn and destroy your properties, rape your women, kill your children. The least you could do is to give them hell while retreating.",1648568483.0
"These little hermit countries are MiNd FuCkEd - People rally in support of Russia in Belgrade, Serbia.",68,t6z9ua,RussiaUkraineWar2022,https://v.redd.it/cz0jakpu6hl81,58,,1646447092.0
"With the Azovstal plant being evacuated, Russia now have a land bridge from Russia down to Crimea",44,urmf58,RussiaUkraineWar2022,https://i.redd.it/bcuvf7ihf1091.jpg,51,,1652793957.0
Members of Azov taken is as POW by Russian forces. God speed for you lads.,48,tkjqp0,RussiaUkraineWar2022,https://v.redd.it/mq2xieain1p81,38,,1648002328.0
Moscow says opening Ukraine ports would need review of sanctions on Russia - Interfax,16,ut26y0,RussiaUkraineWar2022,https://www.reuters.com/world/europe/moscow-says-opening-ukraine-ports-would-need-review-sanctions-russia-interfax-2022-05-19/,16,,1652962856.0
Another Ukrainian prisoners in Mariupol,17,u675et,RussiaUkraineWar2022,https://v.redd.it/xhsk0i0sm8u81,6,,1650266071.0
"DNR militants carried out an assault on a Ukrainian trench line in Donbass, resulting in mass casualties of Ukrainian troops in the area. Rest in peace.",0,x3plld,RussiaUkraineWar2022,https://v.redd.it/qoemmwcjcel91,14,,1662085168.0
New russian coat of arms,57,vuxcu7,RussiaUkraineWar2022,https://i.redd.it/dxq4h8egqja91.jpg,25,,1657356050.0
Spot the Difference,108,t2b8y2,RussiaUkraineWar2022,https://i.redd.it/odgdcm7zr9k81.jpg,37,,1645921444.0
Lavrov says Russia was forced to invade Ukraine,72,xngcsd,RussiaUkraineWar2022,https://www.msn.com/en-us/news/world/lavrov-says-russia-was-forced-to-invade-ukraine/ar-AA12cLAr,60,,1664089953.0
should NATO start providing more advanced weapons like cruise missiles to allow do Ukrainian military to hit ships and Russian cities?,133,tdz67m,RussiaUkraineWar2022,https://www.reddit.com/r/RussiaUkraineWar2022/comments/tdz67m/should_nato_start_providing_more_advanced_weapons/,123,,1647269289.0
Iran sending Russia Fatteh ballistic missiles,38,w3654s,RussiaUkraineWar2022,https://www.reddit.com/r/RussiaUkraineWar2022/comments/w3654s/iran_sending_russia_fatteh_ballistic_missiles/,61," 

Iran provides Russia NOT just with drones but Fattteh class ballistic missiles

Russian ground-ground ballistic missile shortage has forced Russian military to source Iranian Fatteh-110 and Fatteh313 Ballistic missile combined with the drone systems needed for ground targeting. Russian military sources indicates that they have specifically requested this system after witnessing their performance against the American military base attack in Iraq by the IRGC in revenge for killing general Soleimani. The Russian military attaché in Tehran indicated that Iranian solid fuel rocket systems are among the best in the world and will be critical to the advancement of Russian military aims in Ukraine.",1658271419.0
"How about some nato country ""invade "" Ukraine and claim it its own territory what would happen",40,t5x95p,RussiaUkraineWar2022,https://www.reddit.com/r/RussiaUkraineWar2022/comments/t5x95p/how_about_some_nato_country_invade_ukraine_and/,58,"&#x200B;

https://preview.redd.it/63q3fp8uh7l81.jpg?width=1200&format=pjpg&auto=webp&s=ec5b36b6172c5f7d263ffd25ed090e076515267b",1646329674.0
"Russian footage will be getting shared in this community for the sake of educational purposes. Just because the Russian military are destroying Ukrainian equipment doesn't make it propaganda. It is combat footage. To get an accurate picture of what's going on, both sides need to be shared.",278,wimsnn,RussiaUkraineWar2022,https://www.reddit.com/r/RussiaUkraineWar2022/comments/wimsnn/russian_footage_will_be_getting_shared_in_this/,28,"However, we do not permit posts that are blatant lies from the Russian Federation",1659897769.0
"Putin says that the ""Operation"" is successful🤢🤮🤮🤮 Oh yeah, bombing civilians... Bravo",29,tfsuoo,RussiaUkraineWar2022,https://www.reddit.com/r/RussiaUkraineWar2022/comments/tfsuoo/putin_says_that_the_operation_is_successful_oh/,5,,1647463931.0
Another joint patrol between Russia and Turkey around Kobanê today. NATO-Russia tensions to the north don’t matter here.,25,t8want,RussiaUkraineWar2022,https://v.redd.it/96k77n68c0m81,28,,1646678889.0
Unconfirmed. Could be bad.,27,t59u7f,RussiaUkraineWar2022,https://i.redd.it/ejqxanvd91l81.jpg,9,,1646254184.0
"Ukrainian soldier seen with a German Panzerfaust, this anti-tank weapon can destroy all Russian tanks within micro seconds of impact. Tank crews FEAR them.",286,tjr6o6,RussiaUkraineWar2022,https://i.redd.it/c2qe1m035uo81.jpg,18,,1647911382.0
Hoping We Can Make This Go Viral,77,t4sc07,RussiaUkraineWar2022,https://www.reddit.com/gallery/t4sc07,0,,1646197481.0
"Putin is trusted by 79 percent of Russians - this is evidenced by the results of a survey by the Public Opinion Foundation. Apparently Russia is a country of idiots. This is of course a stupid question, but do you support Putin's fascism?",526,vzjpzs,RussiaUkraineWar2022,https://i.redd.it/vjxdt6xj2pb91.jpg,237,,1657874501.0
My Russian Friends on Social Media,43,w7nsal,RussiaUkraineWar2022,https://www.reddit.com/r/RussiaUkraineWar2022/comments/w7nsal/my_russian_friends_on_social_media/,70,"I travelled around the world a few years ago and went through Russia and made several friends there. All very nice people who I respect....at least until recently. Russia has invaded Ukraine and all bar one of these friends of mine have just carried on like nothing has happened. One is completely ashamed to be Russian and actively posts on Facebook against the war at great risk to himself but the others just keep posting banal photos of themselves having fun in their day to day lives, all the while their army is slaughtering civilians and committing warcrimes in an unjust war. Part of me wants to call them out to at least stop posting shit like everything is fine, and part of me understands that they almost certainly don't support the war but it's not worth the risk of speaking out and they just have to get on with their day to day lives....thoughts??

Edit: I'm not American. Also I'm not asking for these people to start posting against the war and risk imprisonment. Maybe just to tone down the cute latte art posts while their country illegally occupies Ukraine.",1658752351.0
"Germany's police took the flag from Ukraine's procession in Berlin. Earlier it was stated that RU & UKR symbols were prohibited for May 8th and 9th only close to specific monuments. Anyway, equalising the Ukrainian flag with Russian war symbols is more than offensive. - Ukraine World",190,ulaqby,RussiaUkraineWar2022,https://v.redd.it/98rl3opadby81,69,,1652042604.0
Ukrainian forces captured this Russian drone in the Mykolaiv region and took her for a test flight.,59,wskg86,RussiaUkraineWar2022,https://v.redd.it/08tek7hjlpi91,6,,1660931831.0
"Trench warfare in Kremmina, Luhansk region.",49,ugvtc5,RussiaUkraineWar2022,https://v.redd.it/s0q8p5s9s3x81,15,,1651514987.0
