title,score,id,subreddit,url,num_comments,body,created
Russell Bently's video from Mariupol today.,11,u5o56g,RussiaUkraineWar2022,https://v.redd.it/nb82y27ym3u81,241,,1650205659.0
"Sickened by Putin's genocide, why didn't the West go into Ukraine to help them? Where is our empathy?",0,twztp8,RussiaUkraineWar2022,https://www.reddit.com/r/RussiaUkraineWar2022/comments/twztp8/sickened_by_putins_genocide_why_didnt_the_west_go/,251,"Seeing the **images** of tied up executed people, reports of men tortured, raped women, children killed, etc. I cannot fathom it. It's shamefully disgusting, do Russians not see what they're doing is reaching  to a Nanjing massacre level?

Besides, *what exactly has to happen to a human for them to become so spiritually sick that they'd willing commit such atrocities?*

Finally, why did our governments in the West not go in and meet Russia's army in Ukraine? We could have prevented this by pushing Russia's weak army out. Putin is crazy, but I'm sure even he realizes that a nuclear war would be suicide and the end of life on earth. I suspect even he wishes to live. We were cowardly and stood by in fear whilst innocent people got massacred. It's better to die standing up to a big bully than to let the bully kill us off one by one.

It's so sad to see what is happening and to think our governments had such a weak response. Also to see some making excuses for that weak response. It's hard not to look at the videos of innocent Ukrainians killed, the tears, and to think how I would feel if I were Ukrainian: I would feel abandoned by the world.

*“The only thing necessary for the triumph of evil is for good men to do nothing,”*

**EDIT: To the billion replies saying ""blah nukes blah"". If Russia invaded Alaska, I guarantee you the USA would have no problem bringing the war to Russia. The reason the USA (and Canada, where I live) don't give a flip, is because it's not us. We have become self-centred beyond all measure.**

**EDIT 2: Thank you for all your responses. Well, some folks here are just so rude: Are you ok? After a long time off of social media, I'm just not build for Reddit anymore.** ***For that reason, I'm out. Sorry!***",1649178628.0
I have noticed that we are dehumanizing others…,0,xp984u,RussiaUkraineWar2022,https://www.reddit.com/r/RussiaUkraineWar2022/comments/xp984u/i_have_noticed_that_we_are_dehumanizing_others/,198,"I have noticed more and more that we (the pro Ukraine folks) have been dehumanizing the enemy more and more. It is getting pretty ugly. 

It is crossing a line that the Kremlin itself has already done. Heck, the primary wrong committed by the Kremlin and its supporters is the dehumanization of Ukraine (and others). It is at the root of the aggression.

War is evil and we should be cautious not to invite ever more evil into our own hearts and minds. At some point this thing will end, Ukraine will be rebuilt and Russia will have to re-enter the international arena. Criminals will need to be brought to justice.  Ut the rest of us will need to figure out how to move forward. Otherwise this is but a chapter in a story defined by the horrific evils of war. 

This war is particularly ugly; it is fratricidal. Many Ukrainians work(ed) in Russia, a great many families were “blended.” There is a common faith shared by many of the people on both sides. A great and unnecessary evil has been brought by Putin and his allies, enablers and supporters. 

We should be cautious to not irrecoverably poison our own hearts and preclude any sort of reconciliation when this shitstorm is over.",1664261735.0
Germany blocked EU's $9BILLION aid package to Ukraine... They have told Siemens Canada to fix the gas turbines against Zelensky wishes and told Lithuania to remove the block of Kaliningrad. Is it true that Germany is against Russia?,303,vw5fde,RussiaUkraineWar2022,https://i.redd.it/9i6de1r54ua91.jpg,406,,1657499729.0
"to a thousand conscripts of the Armed Forces of Ukraine and civilians, whom they do not allow to surrender,” reports our military commander Murad Gazdiev @msgazdiev from the residential area of ​​Mariupol closest to the plant.",0,ug948b,RussiaUkraineWar2022,https://v.redd.it/5x3itfhhgxw81,18,,1651438335.0
"Soldiers of the 115th Brigade were taken to a pre-trial detention center on charges of desertion, namely leaving their positions without an order",0,uwrmvv,RussiaUkraineWar2022,https://v.redd.it/l4qlbvtykf191,26,,1653401145.0
Ukraine destroys eight Russian Air Force bases!,1,tv8bvq,RussiaUkraineWar2022,https://www.worldopress.com/post/ukraine-destroys-eight-russian-air-force-bases,7,,1648989504.0
"A group of Ukrainian vehicles take Russian artillery fire while entering Pravdyne, Kherson Oblast.",3,xjt5li,RussiaUkraineWar2022,https://v.redd.it/0j2hdtfep4p91,4,,1663729819.0
Orlan UAV footage of Russian TOS-1A thermobaric MLRS strikes.,3,wlfsce,RussiaUkraineWar2022,https://v.redd.it/w5clwd4cvzg91,5,,1660184495.0
"Destruction of the target of the Armed Forces of Ukraine on the screen of the fire control complex ""Kalina"" of the commander of a T-90M",3,vx5wta,RussiaUkraineWar2022,https://v.redd.it/y1bqcqlsh3b91,31,,1657613350.0
"Once lauded by international media, a Canadian sniper known as #Wali returned from Ukraine to Quebec, he supposedly told local media his experience there was terrible disappointment, there was inadequate weaponry, poor training and heavy losses, as well as profiteering & desertion in the ranks?",0,uks3vy,RussiaUkraineWar2022,https://i.redd.it/asc4wcu4x5y81.jpg,96,,1651976624.0
Killed in battles Ukrainian soldiers. Rest in peace. Hero's.,1,wknmlz,RussiaUkraineWar2022,https://www.reddit.com/gallery/wknmlz,3,,1660104253.0
Something people are overlooking: A Russian ambassador said an economical war is grounds for a physical war,2,t4pqgc,RussiaUkraineWar2022,https://www.reddit.com/r/RussiaUkraineWar2022/comments/t4pqgc/something_people_are_overlooking_a_russian/,25,"So all the sanctions we're doing towards him and the economy, especially all of his funds and the advice troops just being in the region, could push him towards something stupid. He's already gone crazy with his shit, China is already backing them up with Intel, Israel chose their side and who knows North korea hates us too they could consider it an opportunity to see us fall. Russians tech and capability with North Koreas arsenal could be an issue. Belarus and whatever other country decides to join up with them even out of regional impact/fear. 

This situation is kinda being downplayed from what it could be. Putin already proven he doesn't give a fuck about the sanctions or the people in his country, you think he gives a fuck to not go further? Half his citizens are already leaving (could be wrong). 

I could actually be wrong about this whole thing and if I'm missing something then please tell me and let me know. I'm not saying this is factual or is going to happen because it probably won't, it's just a different side to bring to the table for conversation. 

What do yall think?",1646189423.0
“TikTok Battalion” with captured Ukrainian POWs,5,tdopmk,RussiaUkraineWar2022,https://v.redd.it/mqsvbe99x9n81,42,,1647230770.0
Video of a Wagner Kornet ATGM team on the roof of a building in Dolomitne near Kodema.,8,wvwswm,RussiaUkraineWar2022,https://v.redd.it/w2s92km7fij91,7,,1661280801.0
Video of LNR artillery crews with Msta-B howitzers.,3,wky3et,RussiaUkraineWar2022,https://v.redd.it/q22z1sm66wg91,5,,1660139721.0
How would the war play out if Ukraine received a ac-130,6,wpgceq,RussiaUkraineWar2022,https://www.reddit.com/r/RussiaUkraineWar2022/comments/wpgceq/how_would_the_war_play_out_if_ukraine_received_a/,46,,1660611479.0
Russia runs the first test train across the Crimean Bridge after a day of repairs and fire fighting,15,xz0nw1,RussiaUkraineWar2022,https://v.redd.it/tbk21eciqms91,56,,1665255662.0
Ukrainian Su-24M strike aircraft shot down by Russian surface-to-air missile. Pilots eject over Russian held territory.,19,xrk2i6,RussiaUkraineWar2022,https://v.redd.it/twk5v5qncvq91,17,,1664488270.0
Captured Azov member questioned by Russian forces. Presumed killed after the photos were taken. RIP.,0,u7kh8v,RussiaUkraineWar2022,https://www.reddit.com/gallery/u7kh8v,48,,1650416714.0
Captured Ukrainian soldiers in Donbass. Godspeed lads.,15,wthbm0,RussiaUkraineWar2022,https://v.redd.it/3z65zh0vmxi91,10,,1661029128.0
Video of Russian forces firing on a Ukrainian position under a bridge with a MT-12 Rapira anti-tank gun,4,wimy9g,RussiaUkraineWar2022,https://v.redd.it/jvu6s5ly7cg91,8,,1659898175.0
Isolating all russians in Russia regardless of their political beliefs is bad idea. And we should help to anti-putinist russians to leave their homeland,0,x2d5uj,RussiaUkraineWar2022,https://www.reddit.com/r/RussiaUkraineWar2022/comments/x2d5uj/isolating_all_russians_in_russia_regardless_of/,45,"Many people believe that it will encourage many anti-putinist russians to overthrow Putin, but it wouldn't work because the opression mechanism is still strong. It's hopeless to protest somehow and change life in Russia for better. I understand how Zelenskiy feels extremely bad and he is a human with emotions. According to The Washington Post, Zelenskiy wants to send all russians on planet to Russia and he hopes that it will change for better.

Guys, I talked with oppositioneers and most of them are just sitting on homes and praying to ukrainian soldiers for a victory. They understand that they CAN'T DO ANYTHING. If you think that they will make a revolution like they did in late 20s of 20th century you're wrong unless Russia lose the war. We are not living in Hollywood blockbuster about Resistance fighting against tyrannical government.

I think we should to evacuate all russians, who are against Putin, from Russia so they could protest freely and start a new better life. They of course, can emigrate to other post-soviet countries, but it's difficult for them due to high prices and bureacratic things. So, if situation will not get better, anti-putinist russians will in one day give up and go into despair. They just become apathetic doomers or, either way, kill themselves so they could ""emigrate"" to afterlife.

Maybe we need a special psychological test, examine everything about russian emigrant who want to leave his country and etc. Also, I talked with oppositioneers in TJournal and they are not happy how Zelensky calls to send and isolate all russians. They even think that it will only encourage putinists to fight against West.",1661951165.0
Are we allowed to do hot takes? I think the average Russian citizen should be at war… at home.,5,t3z2z2,RussiaUkraineWar2022,https://www.reddit.com/r/RussiaUkraineWar2022/comments/t3z2z2/are_we_allowed_to_do_hot_takes_i_think_the/,14,"I’m sick and tired of people saying “There are protests in Russia too!”, “Those soldiers don’t know why they’re in Ukraine.”, “I hope people don’t go hungry”, and other statements of pity towards the general Russian populace.

I’m also sick of reading the likes of “Russians risk imprisonment, torture, and death if they protest against their government”. 

—

The consequence of Russian nationals failing to protest and failing to modify their government [to halt hostilities] is by default, causing loss of human life outside their domain.

If Russians truly want peace, they must be willing to face the risks of war. The same risks Ukrainians have been facing: Death, torture, and imprisonment; until cessation of hostilities and the complete expulsion of Russian Armed Forces in Ukraine.

Hard assistance from NATO cannot be provided to Ukraine as the world would risk a nuclear war initiated by Russia. This is a fight between the people of Ukraine and the Russian Federation (which includes Belarus)

The people of Russia must assume the incredible risks that come with war. If not, they must be stripped of all luxuries and experiences of a modern human. I support every sanction that impacts the “average” Russian citizen.

If the population of Russia fails to respect the current state of events and do not assume responsibilities, the net punishment of the Russian Federation should be that of a weakened and desperate people with Putin’s existing government in hopes to mitigate the cycle of Russian aggression.",1646108265.0
He posted this videos in the uniform saying how proud he is to be Russian.,33,x491yf,RussiaUkraineWar2022,https://v.redd.it/tiojszirphl91,107,,1662143935.0
"🎥 Published images of Russian drones and rocket launchers cooperating on the battlefields in Ukraine ⭕️UAVs detect targets and position them to rocket launchers, and rocket launchers destroy the target. 🤬",0,ukh3ci,RussiaUkraineWar2022,https://v.redd.it/kimj8w6i03y81,7,,1651941442.0
"Armored vehicles of the ""Rus"" battalion firing at suspected Ukrainian positions in the village of Peski",3,ue1yay,RussiaUkraineWar2022,https://v.redd.it/pgivf86wdbw81,8,,1651171105.0
Video of Russian Mi-35M and Mi-28N helicopters in the south.,0,wmxhk1,RussiaUkraineWar2022,https://v.redd.it/ximkex5ewch91,4,,1660342237.0
Article from 8 years ago predicting russia-ukraine war,0,uku4ro,RussiaUkraineWar2022,https://www.reddit.com/gallery/uku4ro,54,,1651984298.0
Why not send Ukraine Special Forces to Russia?,0,tn3f0q,RussiaUkraineWar2022,https://www.reddit.com/r/RussiaUkraineWar2022/comments/tn3f0q/why_not_send_ukraine_special_forces_to_russia/,45,,1648154633.0
The cleansing of Mariupol and the Azovstal plant is in full swing. Source: Russia,0,u8ngly,RussiaUkraineWar2022,https://v.redd.it/uhmzlen9uvu81,32,,1650547056.0
"Video from April 18 but in good quality. A double strike by ""Caliber"" on a large logistics center in Lviv, where Western weapons were brought.",5,ub0hce,RussiaUkraineWar2022,https://v.redd.it/48y3uyk6oiv81,14,,1650823481.0
I agree that these videos of Ukrainian bandits tied to poles is inhumane. How do they go the toilet? (you guessed it) And does anyone know how long they're usually tied up for?,2,tjfrh9,RussiaUkraineWar2022,https://www.reddit.com/r/RussiaUkraineWar2022/comments/tjfrh9/i_agree_that_these_videos_of_ukrainian_bandits/,17,,1647880130.0
Work of Russian artillery SAU 2С-7 with guided missiles.,2,tpufkp,RussiaUkraineWar2022,https://v.redd.it/uyfmwfcl10q81,6,,1648418702.0
"The result of the work of Chechens in Ilyich plant, Mariupol.",0,u6ayj6,RussiaUkraineWar2022,https://v.redd.it/kxgahc7sw9u81,40,,1650281549.0
"Video of Wagner mortars, D-30 howitzers, MT-12 Rapira anti-tank guns, and BM-21 Grad MLRS.",0,wvwzgx,RussiaUkraineWar2022,https://v.redd.it/z1hjy2gigij91,5,,1661281237.0
Have some humanity,330,votr9f,RussiaUkraineWar2022,https://www.reddit.com/r/RussiaUkraineWar2022/comments/votr9f/have_some_humanity/,421,"I don't use Reddit very often at all, and I will not attribute this behaviour to reddit users themselves for the meme. I do lurk around every now and then though and I feel the need to share my (sadly) uncommon perspective.

I'd like to make the perfect example of a post from a day ago, titled ""Russian soldier denazifies himself"" with a picture of a russian soldier holding a rifle in a pool of blood with a bullet hole in his head. Does talking about the loss of a human life like this not absolutely revolt you?

Yes, russian troops kill, rape, destroy, etc. But does that excuse celebration of the fact that some are dying in these dire, depressing conditions? A lot of them don't even want to be on the battlefield. They know they're fighting for the wrong cause, yet their rivals are praised whenever they commit the same kind of senseless murder against them. Yes, it's to defend their homeland. But taking a picture next to a man whos family just lost someone they loved is disgusting no matter the context.

If a soldier (doesn't matter the side) who has raped and murdered women and children in a war takes his own life, I'd struggle to feel a lot of sympathy but I absolutely would not celebrate it. I would never celebrate the shortcomings of the world order that allowed everything to happen in the first place.

Ukrainian red cross has recieved $9.8 million to date since the beginning of the war, yet when keyboard warriors get the opportunity to act cool and badass by cracking jokes about countless people and families ravaged by the war, they're first in line. It's a curious case and if you're one of these people I'd suggest you take what I said into consideration or at the very least have a conversation with me if you disagree.

EDIT: My main point is if you revel in seeing a dead Russian soldier with no prior context, I'd argue you're the same propagator of violence you describe them as (albeit, obviously lesser, but still you are one)",1656656002.0
Another group of the Armed Forces of Ukraine was ambushed,7,uen9tm,RussiaUkraineWar2022,https://v.redd.it/nr1srca9bhw81,5,,1651242865.0
France Says It Won’t Deploy Nukes If Russia Uses Them Against Ukraine,15,y2u5mi,RussiaUkraineWar2022,https://www.bloomberg.com/news/articles/2022-10-12/france-won-t-deploy-nukes-if-russia-uses-them-against-ukraine,75,I guess that France already surrendered? 🏳,1665653102.0
"KIA Ukrainian servicemen after battles with Russian militants in the East of Ukraine. Shared for educational aspects regarding the current conflict. The following images may disturb some members, however you do not need to click past the spolier.",0,x18e4y,RussiaUkraineWar2022,https://www.reddit.com/gallery/x18e4y,38,,1661829908.0
A DNR T-72B3 tank in the Pisky area.,6,wpk154,RussiaUkraineWar2022,https://www.reddit.com/gallery/wpk154,4,,1660621925.0
"Outgoing Russian BM-21 GRAD near Soledar frontline early this morning. 24/Aug/22 He says - ""Congratulations on Independence Day of Ukraine and revenge for war comrade Dugina""",0,ww870f,RussiaUkraineWar2022,https://v.redd.it/58l0il24vkj91,59,,1661310363.0
Russian artillery strikes in the Zaporizhzhia direction.,3,w8z2xq,RussiaUkraineWar2022,https://v.redd.it/714bk00x20e91,3,,1658879509.0
"🇷🇺🇺🇦The strikes were carried out on the Odessa Aviation Plant near the Shkolny airfield, where Ukrainian Bayraktar TB2 UAVs are being repaired and maintained.",0,ukd507,RussiaUkraineWar2022,https://i.redd.it/qxl256h412y81.jpg,3,,1651929538.0
Russian soldier denazifies himself,1460,vo6gss,RussiaUkraineWar2022,https://i.redd.it/ulx0xi38yq891.jpg,436,,1656589725.0
People with the Ukrainian flag are being taken away while letting the russia flag wave in Austria,356,umii7w,RussiaUkraineWar2022,https://v.redd.it/0ax8kxehfny81,84,,1652188613.0
The 13th battalion of the 58th brigade of the Armed Forces of Ukraine publicly asks Zelensky to stop using the battalion personnel as cannon fodder.,0,uw76cm,RussiaUkraineWar2022,https://v.redd.it/x68ryzbdt9191,43,,1653331350.0
Wagner private military contractors in the Soledar area.,0,wknmo9,RussiaUkraineWar2022,https://v.redd.it/9yoldcwm8tg91,11,,1660104260.0
"A Ukraine marine from 36 brigade who was taken POW from Azovstal calmly explains that he is innocent in the death of a hostage they had with them in Azovstal, and tells the name of his fellow comrade who knifed the hostage in the cellar.",47,v0q1fq,RussiaUkraineWar2022,https://v.redd.it/ifjy3pvpwi291,62,,1653877268.0
"Crazy footage! Dozens and dozens of Ukrainian POWs in Nikolayek, Kyiv region on March 21 and Russian forces also captured the command post located there. Godspeed lads. Never seen this many good guys captured. Heartbreaking.",64,tore3j,RussiaUkraineWar2022,https://v.redd.it/8zmbsn5unqp81,25,,1648305116.0
General Mordvichev is alive after Ukraine stated he was killed. Watch out for disinformation,7,tqwusr,RussiaUkraineWar2022,https://v.redd.it/t4hb94howaq81,35,,1648550223.0
Extermination,4,tandxr,RussiaUkraineWar2022,https://www.reddit.com/r/RussiaUkraineWar2022/comments/tandxr/extermination/,19,"At this point I think it’s evident that there will not be any United States or NATO boots on the ground in Ukraine. NATO and the US Will continue to sit by and watch Putin flatten Ukraine and exterminate their people. I’m not into politics at all, so I understand I might be a bit ignorant in my statement but I would hope you guys would elaborate as to WHY???

I understand doing so will definitely throw us into a full World War III. But I think about the future. once he’s done flattening Ukraine does life just go back to normal because he didn’t threaten any of the NATO countries or the US? Will he be able to take out as many independent countries as he can with no recourse other than economic strain on his own people which he obviously could care less about?

I cannot tell if Biden/heads of NATO are truly shook by Putin or just playing the game until Ukraine is gone",1646876623.0
Russian flag is raised over the SBU headquarters in Mariupol. May be the beginning of the end for Mariupol,14,ty1lvh,RussiaUkraineWar2022,https://v.redd.it/zbp5b508f0s81,37,,1649294979.0
"Russian marines at Azovstal check the buildings of the industrial zone, move to positions. On the territory of the plant, Russiab military found ammunition and Ukrainian uniforms abandoned under Azovstal",0,ujyhnv,RussiaUkraineWar2022,https://v.redd.it/jtqc2xt6hxx81,20,,1651874429.0
Putin will never take Ukraine. God said so!,15,x1p076,RussiaUkraineWar2022,https://v.redd.it/7nljib9twvk91,35,,1661880394.0
264 Ukrainian Marines surrender in Mariupol. Praying they all can make it home,224,twdc2k,RussiaUkraineWar2022,https://i.redd.it/gmbmcfgbwkr81.jpg,296,,1649107016.0
Effects of sanctions on Russian people,1,t7ln12,RussiaUkraineWar2022,https://www.reddit.com/r/RussiaUkraineWar2022/comments/t7ln12/effects_of_sanctions_on_russian_people/,23,"I'm seeing constant virtue-signal posts on LinkedIn now celebrating sanctions on Russian companies, followed by posts from Russian people clarifying this is Putin's war and not reflective of the vast majority of Russians. (I never see Russian people in US celebrating sanctions.) It's incredibly hard to get actual clarity on the topic, but it's extremely jarring to see the level of cavalier support of sanctions on small Russian companies which obviously hurt Russian civilians, by the same people that are protesting a war that clearly is hurting Ukrainian civilians. The brutal lack of nuance and Instagram-friendly social justice warrior-ing du jour is shameful. Most people know that Russia is not a democracy and that its citizens are indeed protesting Putin's actions. But there's no discussion about American culpability with weakening Ukraine or how these sanctions are going to directly economically depress Russian civilians. How are sanctions going to empower the Russian people to rise up and represent anti-war interests? Truly baffles me how ""thou shalt speak up!"" always overpowers nuanced and analytical discussion.",1646522769.0
Russia steps up attacks on major Ukrainian cities with warning of 'full-scale genocide,3,t57yh4,RussiaUkraineWar2022,https://www.reddit.com/r/RussiaUkraineWar2022/comments/t57yh4/russia_steps_up_attacks_on_major_ukrainian_cities/,3,,1646249116.0
Footage from the blown up Ukrainian helicopter earlier today.,17,tt9jew,RussiaUkraineWar2022,https://v.redd.it/8dcur4l09sq81,1,,1648760194.0
"Ukrainian Missile hits living house in Belgorod. Several missiles were shot down, but one reached the city. Reported: At least 3 dead, 4 injured (including 10 year old)",0,vqbybr,RussiaUkraineWar2022,https://v.redd.it/zz6f9x4b0b991,79,,1656832713.0
A Ukrainian 9A33B-series Osa air defense system TELAR was destroyed by Russian fire.,0,x2nb1w,RussiaUkraineWar2022,https://v.redd.it/6yeoac07w3l91,8,,1661976601.0
Russian Federation soldiers place a grenade in a plastic drinking cup and drop it on the positions of Ukrainian servicemen. First time such a modified weapon has been used.,5,urcyr7,RussiaUkraineWar2022,https://youtu.be/ZVs6rs_5XbE,22,,1652756539.0
Someone for the love of god help me feel better ab the possibility of nukes from Russia,10,tmrglp,RussiaUkraineWar2022,https://www.reddit.com/r/RussiaUkraineWar2022/comments/tmrglp/someone_for_the_love_of_god_help_me_feel_better/,103,I’m too young to die I need help,1648144476.0
