title,score,id,subreddit,url,num_comments,body,created
Russian disco. Bunch of gimps. 🇷🇺 😁,15,tjmnfb,RussiaUkraineWar2022,https://v.redd.it/627lhaop2to81,37,,1647898491.0
Will Russia involve Nato in this war by attacking Poland?,13,tld5ns,RussiaUkraineWar2022,https://www.reddit.com/r/RussiaUkraineWar2022/comments/tld5ns/will_russia_involve_nato_in_this_war_by_attacking/,35,"Here are some thoughts and opinions I would like to share with you guys. 

Moscow imperialists can’t stand the thought of losing the war to Ukrainians. It means, to them, “Great Russians” being defeated by “Little Russians.”  That’s why it’s likely Muscovy will escalate against NATO. Not because they will win, but because they will lose to a peer.

Russia already attacked Poland using unconventional warfare. Putin puppet Lukashenka recruited a ""penal battalion"" of irregular migrants and pushed them over the border from Belarus.  Putin is a KGB man. He'll try to attack NATO indirectly, by using Belarusians or the Kadyrites.

Under no circumstances will Russia allow itself to lose to Ukraine. Russia will escalate the war so it can lose to NATO instead.

The U.S. and its allies won’t fight Russia’s invasion of Europe in Ukraine because of the “risk of WWIII.” But then they claim, incongruously, that they’ll defend a NATO country – where the risk is as great.  Naturally, Putin doesn’t believe the West will ever unite and fight.

Eight years since Russia invaded Ukraine and 26 days since the current offensive started,  there’s no excuse for the U.S. and its allies to remain stuck in a dangerous world of illusions about Russia as a peer power.  Refusing to fight Russia in Ukraine guarantees escalation.

In Ukraine Russia can't escalate the ground war. Russian forces are struggling on many fronts, including routine supply lines and logistics, they are out of food and fuel.  So their only option is to intensify the airstrikes at nite, from 200 sorties to 300, only to demolish Ukrainian cities as much they can.  

There's no chance that weak-assed sanctions will topple Putin and end the war. The Russians get around $1.1 billion a day to finance their invasion of Europe from EU countries, in exchange for oil and gas.  Only defeating the Russian invasion army in battle will bring victory.  


Will we see a provocation against nato might happen soon?  

[Source](https://twitter.com/mhmck)",1648067549.0
Little contribution on my site.,0,tcbx95,RussiaUkraineWar2022,https://www.reddit.com/r/RussiaUkraineWar2022/comments/tcbx95/little_contribution_on_my_site/,1,"Just added the Ukraine Flag on our web site https://radareleven.com to show our support with people in Ukraine and against barbarian Russians.

A little contribution.",1647073496.0
Leadership. True leadership. This man inspires me like no one else. Slava Ukrani!,270,tctq5p,RussiaUkraineWar2022,https://imgur.com/r/memes/huF0KUf,163,,1647127768.0
The work of two pairs of Russian Su-25s in the front line of the Donbass (May 2022),14,umljer,RussiaUkraineWar2022,https://v.redd.it/2g41dmgk4oy81,1,,1652197064.0
"Footage from the dark side, yes the Russians.. They attempt to hit a Ukrainian position in the forests of Mykolaiv, the damage is not known.",0,v1djeu,RussiaUkraineWar2022,https://youtu.be/EkyurnRqKIQ,0,,1653955936.0
Need help with sound facts of Ruzzian wars/aggression towards other nations,2,up0vt7,RussiaUkraineWar2022,https://www.reddit.com/r/RussiaUkraineWar2022/comments/up0vt7/need_help_with_sound_facts_of_ruzzian/,7,"Let me explain, I have someone in my family (55+) that is pro russian, when living in a democratic country and having ability to check different sources regarding the war (watches a lot of Rus propaganda channels on TV/internet). However, whenever I bring up the topic, whatever I bring to discussion I get the classical whataboutism.

Could you help me get a a list of facts how Russia being doing this kind of ""politics"" not only in Ukraine, but other countries as well (or even inside Russia). Would like to understand more what happened in 2014 in Ukraine, how the regions got annexed to Russia, how separatists came to be, etc.

I want to get most rigid undeniable facts and possibly I can then help them see the truth, thank you.",1652474415.0
Is it correct … russia-seized-two-ukrainian-ships-in-the-black-sea …. Are NATO also there… has Romania a navy…?,2,t92zbi,RussiaUkraineWar2022,https://www.reddit.com/r/RussiaUkraineWar2022/comments/t92zbi/is_it_correct/,2,,1646696522.0
Ukraine,3,t6n6v2,RussiaUkraineWar2022,https://www.reddit.com/r/RussiaUkraineWar2022/comments/t6n6v2/ukraine/,3,"Anyone can tell you to be so brave and lay down your life for your country while they are in the worm of their homes.

in order to listen to those flashy words and for these words to have meaning, they must come from someone like you an ordinary human being living next door. who is also ready to lay down his own life in order to save you and your family and his of course so fuk offf you comfortable people and don't tell those in real danger what to do or come and fight.

like Mandela said one day the worst thing to do is to tell someone to sacrifice for others and till them, if I were in your place I was going to do the same because you are not in his place",1646412365.0
PLEASE STOP WAR | UKRAINE CRISIS| LOVE FROM INDIA.,0,t2k98w,RussiaUkraineWar2022,https://youtube.com/watch?v=r-pV1-jYDYg&feature=share,4,,1645952801.0
Please Stop!!,0,ttnwlx,RussiaUkraineWar2022,https://www.reddit.com/r/RussiaUkraineWar2022/comments/ttnwlx/please_stop/,16,Today is probably the 37th day of Russia-Ukraine War...both the countries have majority of families which r interrelated...Sm Russians hv families in Ukraine...nd sm Ukranians hv families in Russia....After so much losses of both the countries (More of Ukraine)......It's a genuine request to end the War...It's High-Time....I hope there r more people who Support This Post...Pls Share nd Support this movement🙏🙏,1648810713.0
India’s PM Modi says he’s keen to boost ties with Russia,22,x8z38j,RussiaUkraineWar2022,https://www.cnbc.com/2022/09/08/indias-narendra-modi-keen-to-boost-energy-and-other-ties-with-russia-.html,27,,1662639688.0
"The Ministry of Defense of the Russian Federation showed the launched of the ""onyx"" rockets in Odessa",19,uhqdqm,RussiaUkraineWar2022,https://v.redd.it/bw91ppavvbx81,10,,1651613004.0
Ukrainian forces captured recently by Russian militants. Godspeed for you lads. Shared for educational and factual news regarding the current conflict. OSINT 24/7 at r/RussiaUkraineWar2022,24,wjte2q,RussiaUkraineWar2022,https://v.redd.it/2e8karb43mg91,9,,1660017634.0
Current war standings?,1,u1b79d,RussiaUkraineWar2022,https://www.reddit.com/r/RussiaUkraineWar2022/comments/u1b79d/current_war_standings/,25,"As of this moment, how would you describe things? Is Ukraine “winning”. Unbiased opinions pls! I would like to hear not from the news, and from actual people.",1649693317.0
"Another Indian student was shot in war-torn Ukraine, is hospitalized in Kharkiv",0,t6cxaa,RussiaUkraineWar2022,https://www.ibtimes.sg/ukraine-war-another-indian-student-shot-hospitalized-kyiv-63160,1,,1646376538.0
What level of force intervention in Ukraine would not trigger a nuclear response?,1,t5rtpr,RussiaUkraineWar2022,https://www.reddit.com/r/RussiaUkraineWar2022/comments/t5rtpr/what_level_of_force_intervention_in_ukraine_would/,37,I am coming to the belief that a European only assault of maybe 5 or 6 regimental hunter killer teams could be exactly what's needed.  The US simply can't get involved for nuclear reasons but we could certainly redeploy troops to defend Europe.  Coordinated strikes into occupied Moldova and Georgian regions might even throw russia into crisis and possibly topple Putin's rule.  I really believe it's time for a Europe for Europeans strategy.,1646314860.0
A Ukrainian BMC KİRPİ MRAP was destroyed by the Russian army in Kherson Oblast.,17,xtxneu,RussiaUkraineWar2022,https://i.redd.it/4je9mkec3gr91.jpg,7,,1664739377.0
That would be so helpful in some areas! Terrifying at the same time,22,u110ie,RussiaUkraineWar2022,https://v.redd.it/g3jdj66t0ms81,13,,1649657699.0
The Russian 7th Guards Mountain Air Assault Division destroyed Ukrainian self propelled artillery in the East recently.,0,wimgc3,RussiaUkraineWar2022,https://v.redd.it/0wqta4n34cg91,11,,1659896874.0
Russia UAV footage showing artillery strikes on a Ukrainian oil facility in the south.,0,w904fc,RussiaUkraineWar2022,https://v.redd.it/z3kykop4b0e91,7,,1658882286.0
Russian boy has a message for those choosing to flee the mobilization.,77,xxdg4n,RussiaUkraineWar2022,https://v.redd.it/m3xkbmi3i8s91,140,Reminds me of another youth organization……,1665083330.0
Thoughts? on U.S Colonel and former Virginia senator Richard H. Black assessment on the war in ukraine? Is this sustainable ?,0,vhp5tv,RussiaUkraineWar2022,https://v.redd.it/vyh5w8dyt1791,88,,1655849761.0
"here's a pitch, why don't we invade Russia and liberate them from the actual Nazi terrorist scum.",93,tk1kd3,RussiaUkraineWar2022,https://www.reddit.com/r/RussiaUkraineWar2022/comments/tk1kd3/heres_a_pitch_why_dont_we_invade_russia_and/,130,,1647951148.0
Fighting for Mariupol by the Armed Forces of the RF,0,v0b5f5,RussiaUkraineWar2022,https://v.redd.it/69z9kvo12f291,1,,1653830740.0
Video of a Russian T-90M tank in the Kharkiv direction.,30,wmxikj,RussiaUkraineWar2022,https://v.redd.it/15csotokwch91,12,,1660342307.0
I'm American and I want the world to remember this quote,55,t6x18u,RussiaUkraineWar2022,https://www.reddit.com/r/RussiaUkraineWar2022/comments/t6x18u/im_american_and_i_want_the_world_to_remember_this/,51,"“The only thing necessary for the triumph of evil is for good men to do nothing,”

I was totally against sending our troops to fight in this conflict. However these images coming out of Ukraine are heartbreaking. If we sit by and do nothing then we are almost as bad as those perpetrating these attacks. When all else fails send the troops. I know the stakes are high but anyone who can sleep peacefully  at night after seeing these images need not apply.",1646439803.0
Video reportedly showing a Ukrainian M777 howitzer targeted by artillery fire from Russia’s 3rd Motorized Rifle Division.,0,wky3uc,RussiaUkraineWar2022,https://v.redd.it/h9742lma6wg91,3,,1660139754.0
"Appearing on Russian state TV, Margarita Simonyan",17,uwfle8,RussiaUkraineWar2022,https://v.redd.it/rwet0teiub191,46,,1653355938.0
deepfakeputin,4,tdxesp,RussiaUkraineWar2022,https://www.reddit.com/r/RussiaUkraineWar2022/comments/tdxesp/deepfakeputin/,16,"im old and way too stupid to be able to do it myself , however is there someone out there who can create a deepfake of putin telling russian troops to retreat and come home , he is sorry for being a worldclass dickface ..

my guess is at least half would want to believe it enough to just turn around and go home and i dont think they have enough fuel to go back",1647264190.0
Fallen Ukrainian Military in Donbass. R.I.P,0,ww810x,RussiaUkraineWar2022,https://v.redd.it/1berhpcttkj91,7,,1661309921.0
"Few of those ‘kherson contra attack’ casualties of Ukraine army. Wounded pows, one treated by medics. Video from Russia or Donbas spetsnaz.",0,vgstir,RussiaUkraineWar2022,https://v.redd.it/wiw1r4quot691,32,,1655751189.0
The Ministry of Defense of the Russian Federation showed combat footage of the Ka-52 helicopter in the Donbass region,24,ulvmok,RussiaUkraineWar2022,https://v.redd.it/dbn68xmochy81,19,,1652115046.0
In the name of Ukraine ❤️🔥 Absolutely spectacular.,34,ttgvdx,RussiaUkraineWar2022,https://v.redd.it/8lapqv2r3uq81,8,,1648782634.0
"Russian artillery somewhere in Ukraine, look at all of those shells!",33,thdk4s,RussiaUkraineWar2022,https://v.redd.it/bzpedyjl57o81,24,,1647633102.0
Which country (Russia or US) will be the First To Send an Impeached President to Prison? --- Constructive challenge to help end war by creatively supporting Russians who would like to take Putin out of power using their power of impeachment granted in the Russian Constitution.,0,tpv753,RussiaUkraineWar2022,https://www.reddit.com/r/RussiaUkraineWar2022/comments/tpv753/which_country_russia_or_us_will_be_the_first_to/,58,"With twice impeached Donald Trump running out of time as a free man: the US currently has the lead. But this would be the first time Russians will fully get to try out the emergency impeachment powers in their relatively new Russian Constitution, and Putin's brilliance has given him a pages long list of war crimes that are in his favor, in this race.

[View Poll](https://www.reddit.com/poll/tpv753)",1648421087.0
New video of Chechens fighting for Russia in Ukraine,9,t2taef,RussiaUkraineWar2022,https://v.redd.it/m2ibc2czvek81,39,,1645983331.0
Putin's reaction to the Turkey delegation's hug at SCO summit.,70,xijltq,RussiaUkraineWar2022,https://v.redd.it/mmp54ipctuo91,54,,1663610155.0
My reaction to the war in Ukraine,26,vkrddx,RussiaUkraineWar2022,https://www.reddit.com/r/RussiaUkraineWar2022/comments/vkrddx/my_reaction_to_the_war_in_ukraine/,13,"Hello Ukraine!

Following the ongoing war against Russia, I want to react to this.
First of all, I condemn the Russian government, Donetsk separatists,  Luhansk separatists and everyone else supporting and defending Russia and it's allies for this inhumane war.
May they pay their prize one day and have a suitable punishment for this.
I cannot still believe that there's a war going on in Europe including Ukraine and I feel sorry to all victims of the war.
I've respect to the Ukrainian Army, because they're fighting for their country, the territorial integrity, culture, values and people.
I've also respect for the Ukrainian people because they're living in uncertainty and in tough times but still they're motivated because they believe this all will end well but also because the hell and pain they need to endure right now because of the war.
I've respect for the Ukrainian government too, because they're leading Ukraine, it's people and army during challenging times.
I'm glad that many people including me and countries are standing with Ukraine and are helping them and I want to let this continue because this is important for Ukraine.
I hope that the victory will be for Ukraine or that there will be peace there and the territorial integrity will be respected, that Ukraine will be restored one day as it was before the war and also that all occupied territories rightfully belonging to Ukraine will be returned to Ukraine.
I also hope that the Ukrainians can live in peace and safety without fear and concerns one day.

As last, I want to say:
- Crimea is Ukraine!
- Donetsk is Ukraine!
- Luhansk is Ukraine!

I respect the territorial integrity of Ukraine and recognize these territories only as part of Ukraine.
 
This was all I wanted to say about the war in Ukraine, may fortune, luck, prosperity and peace with you.

Слава Україні! Героям слава!/Glory to Ukraine, glory to the heroes! 👍💛💙🇺🇦


As last I've one message to the Russian government, Putin, the army, their allies and everyone else supporting them:
TAKE YOUR DAMN HANDS OFF UKRAINIAN TERRITORY AND GO FUCK YOURSELF!!!!
Please check out my rant about Putin & Co because they deserve to die in hell!!: https://www.reddit.com/r/rant/comments/veoud7/putin_co_should_burn_in_hell/
I've also a message to those ******: https://www.reddit.com/r/rant/comments/vks4q5/my_message_to_the_occupiers_of_occupied_parts_of/
Lastly, this is my reaction to the war: https://www.reddit.com/r/ukraine/comments/vkr841/my_reaction_to_the_war_in_ukraine/",1656200022.0
My Ukrainian friend thinks Ukraine is losing?,13,tta6hr,RussiaUkraineWar2022,https://www.reddit.com/r/RussiaUkraineWar2022/comments/tta6hr/my_ukrainian_friend_thinks_ukraine_is_losing/,49," He lives near Kharkiv. He thinks because Ukraine has been unable to relieve Mariupol and he says that his friends unit was ordered to retreat from the Donbas that Ukraine may not be winning overall, and may have to let Russia keep the Donbas. If this entire war was fought simply to be able to go in to the EU, while Russia gets everything else it said it wanted, seems like an awful waste. 

I guess the problem is also Ukrainians actually care about the lives of their people, and Putin just cares about winning.",1648761930.0
Russian Sniper uses a sowing machine as a rest 😬,63,wsk33y,RussiaUkraineWar2022,https://v.redd.it/ajnmah3wipi91,52,,1660930938.0
I hope this person has removed the license plate cover (photo taken a few weeks ago…),13,u7h1qe,RussiaUkraineWar2022,https://i.redd.it/d0tcr4ic8ku81.jpg,7,,1650406500.0
"In Melitopol, the rouge Russians begin to patrol the city.",18,tb56r7,RussiaUkraineWar2022,https://v.redd.it/ldtr6wvcnlm81,27,,1646936872.0
Russians raise the flag of the “Samolia” Battalion in Mariupol,0,tq6w24,RussiaUkraineWar2022,https://v.redd.it/m8ryylo9x3q81,6,,1648465903.0
"It's 2022, Russia, upgrade your shit",306,ucaxks,RussiaUkraineWar2022,https://v.redd.it/iemx35095vv81,71,,1650974489.0
Russian troops absolutely annihilated by Ukrainian Defence Force 👌 Excellent footage.,37,tcj5n8,RussiaUkraineWar2022,https://v.redd.it/3elnr9s05zm81,12,,1647100202.0
"Follow us on TikTok for censored updates, daily.",4,tun4ac,RussiaUkraineWar2022,https://vm.tiktok.com/ZMLxLA2f6/,1,,1648917663.0
"Maajid Nawaz Member Podcast: Azov Soldier Dips Bullets in Pig Fat, Crew Discusses SWATTING And Religion",0,t5s9qv,RussiaUkraineWar2022,https://timcast.com/members-area/maajid-nawaz-member-podcast-azov-soldier-dips-bullets-in-pig-fat-crew-discusses-swatting-and-religion/,11,,1646316211.0
#Russia is a prison of nations!,449,v34xdj,RussiaUkraineWar2022,https://i.redd.it/1cnxyzydf6391.jpg,217,,1654162047.0
Bandits captured. Labour duties are needed in Ukraine.,46,tbfy5s,RussiaUkraineWar2022,https://v.redd.it/91gd4klz3om81,10,,1646966678.0
"This is one of the deference between Ukraine and russia, and why Ukraine will soon win🇺🇦",50,ta3nq0,RussiaUkraineWar2022,https://i.redd.it/7beupfcznbm81.jpg,17,,1646816011.0
BTR-80 ripping off a Ukrainian coat of arms of a wall in city square. Kherson. #Ukraine 05/2022,188,uvk5x5,RussiaUkraineWar2022,https://v.redd.it/wpfvudwjd3191,95,,1653253370.0
"This man in the center is the US senator Rand Paul, he has blocked an aid for Ukraine, that keep fighting Russian invasion. There are still people in civilized world, who can lobby Russia after all the athrocities they have committed in Ukraine.",705,upb72n,RussiaUkraineWar2022,https://i.redd.it/wrdaxxa7ydz81.jpg,556,,1652509686.0
Russian reconnaissance group in Kharkiv Oblast.,35,wlfvfl,RussiaUkraineWar2022,https://www.reddit.com/gallery/wlfvfl,16,,1660184745.0
not enuf Americans care about this war,219,xtrt7r,RussiaUkraineWar2022,https://www.reddit.com/r/RussiaUkraineWar2022/comments/xtrt7r/not_enuf_americans_care_about_this_war/,188,"In my neighborhood, I'm the only one following this war.  If I try to talk about it with my neighbors they just blow it off.
Do ppl not understand the reality that this war can change the whole dynamic of the world?  If nuclear instruments are brought in, Ukraine will suffer terribly and lose land that will be unusable for growing crops that feed the word.  Not to mention the devastation of the civilian population. 
And I truly believe Putin is crazy enuf to resort to this just so he can go down in infamy.  That's all he cares about.
And winter is fast approaching.  I worry so much about losses on the Ukraine side just from the number of fodder Putin has placed in front of them to use up all the amo.  Maybe it's just me but I celebrate the victories, but I still sit on pins and needles praying for the Ukraine soldiers.  God bless them, their exhausted but still want to fight, and keep their sense of humor. Please watch over them all whoever is up there.
RESPECT

Ok.  For everyone slamming me for using ""enuf"".  I simply use it as I have a tiny phone and my fingers have a hard "" enough"" time getting the right buttons.  Just as I use ppl for people, sry for sorry. My God had I known I'd offend so many ppl that its all they care about instead of what I'm saying, I'd have not done that.  I honestly do not understand why it's upset so many ppl, so I will be the better person and apologize",1664725128.0
Iranian drones bring back fear for Ukrainians,14,xq5h0s,RussiaUkraineWar2022,https://www.newsrnc.com/2022/09/iranian-drones-bring-back-fear-for-Ukrainians.html,8,,1664348333.0
Reportedly footage of a Russian Pantsir-S1 engaging an aerial target,13,x0d1m1,RussiaUkraineWar2022,https://v.redd.it/fw093wgdckk91,1,,1661739903.0
When future Putin is lying on his deathbed and reflecting on his life; what advice do you think that Putin would give to the Pre-24 February Putin if he had the chance?,11,wer5ax,RussiaUkraineWar2022,https://www.reddit.com/r/RussiaUkraineWar2022/comments/wer5ax/when_future_putin_is_lying_on_his_deathbed_and/,24,"My thoughts:

**Dear Pre 24 Feb Putin**

The corruption that has been so rampant during your dictatorship has hollowed out your military capability to a much greater extent than you could understand. The slavish yes men who are your military leadership don’t have the guts to inform you that the invasion of Ukraine is destined to fail spectacularly.  The once feared Russian army will become the laughing stock of the world driven by abject military failure, ridiculous attempts at propaganda, and the obvious amazement that your people have over simple things such as washing machines, toilets and mattresses, that seemingly are not available in Russia and hence need to be stolen. The atrocious disregard for human life and war crimes committed by your army will be the start of a cold and bleak cultural “Russian  Winter” with Russia remaining cut off from the international community; and the West more united than ever. The thing that will begin to thaw the winter is when, having suffered horrendous losses in their communities and being starved of the benefits of the international economy; the people rise up, supported by the Oligarchs (who want their megayachts and private planes back) and end up determining that they are better off with you out of the picture. This single decision is the worst decision you could possibly make and is directly responsible for significantly shortening your life expectancy.

DON’T DO IT.

Kind regards,

**Future Putin.**",1659484525.0
"Putin Has Launched the First Economic World War, and the EU and the West Are His Targets",12,u7o2pz,RussiaUkraineWar2022,https://www.yahoo.com/finance/m/3ef06dfc-6acd-3e4b-9f2e-725f59834421/putin-has-launched-the-first.html,16,,1650428318.0
Russian T-90M tank firing in the Kharkiv direction.,0,wmxfdw,RussiaUkraineWar2022,https://v.redd.it/vk6vy7jwvch91,9,,1660342080.0
"Rats, ships Rats, Ships",14,u3z5uj,RussiaUkraineWar2022,https://www.reddit.com/r/RussiaUkraineWar2022/comments/u3z5uj/rats_ships_rats_ships/,26,So all these IT guys fleeing Russia. They were AOK with Putin until the west said no more money for Russia. Now they looove the west...give us the jobs.,1649994306.0
🇬🇧🇺🇦 The latest British Brimstone rocket lit up in Ukraine. This particular one did not reach its target in the Zaporozhye direction.,25,ukwkhq,RussiaUkraineWar2022,https://www.reddit.com/gallery/ukwkhq,24,,1651994911.0
Opinion | Does Erdogan’s Turkey Belong in NATO?,57,uswxzw,RussiaUkraineWar2022,https://www.wsj.com/articles/does-erdogans-turkey-belong-in-nato-sweden-finland-join-veto-weapons-peace-broker-11652882743?mod=hp_opin_pos_2,156,,1652940989.0
The Kyiv Independent on Twitter,7,uhyz0t,RussiaUkraineWar2022,https://www.reddit.com/r/RussiaUkraineWar2022/comments/uhyz0t/the_kyiv_independent_on_twitter/,5,,1651640170.0
Troops pulled back means _____?,8,tral7m,RussiaUkraineWar2022,https://www.reddit.com/r/RussiaUkraineWar2022/comments/tral7m/troops_pulled_back_means/,32,"Scary thought I had today.

Does anyone have the concern that Russia ""pulling back"" means they could possibly use a new strategy?

Think about it, if they pull back to save their soldiers, what are the chances of Russia using a new strategy on a place with nobody around?

If someone says: ""if 'we' cant have that city, nobody can""

(I dont mean to cause any issue with this post, it's just a concern I had, I play chess and when I move my pieces away/backwards, my queen comes out) think about it.

* as a chess player, this was just a thought I had.",1648575713.0
Make it make sense,0,t7vvg2,RussiaUkraineWar2022,https://www.reddit.com/r/RussiaUkraineWar2022/comments/t7vvg2/make_it_make_sense/,38,"So nobody is worried about all the innocent people in Russia.  All these news coverings they’re showing us in America is something around Ukraine. Now please understand I’m anti war so this is truly from a humanitarian stand point. It’s innocent people in Russia who have nothing to do with the acts their leader made. But yet the world is cutting Russia off!!! How doesn’t this concern anyone?!!  What if this war leaks over into America. Imagine other countries cutting us off, freezing our accounts and refusing aid….can y’all imagine how F*** we will be ??",1646561590.0
Russia’s Tanks Are Dying In Ukraine Thanks To Elon Musk,21,tkglnc,RussiaUkraineWar2022,https://www.reddit.com/r/tech/comments/tkcjto/russias_tanks_are_dying_in_ukraine_thanks_to_elon/?utm_source=share&utm_medium=ios_app&utm_name=iossmf,9,,1647992703.0
Ukrainian forces had little choice but to abandon this Polish T-72M1 Tank in the Kherson region. It was later blown up by Russian forces who tossed grenades in there. The crew did evacuate earlier so they were not harmed.,33,xrhai8,RussiaUkraineWar2022,https://v.redd.it/9qjdd52kruq91,3,,1664481168.0
